{
  "$schema": "../schemas/model-manifest.schema.json",
  "schemaVersion": 1,
  "runtime": {
    "implementation": "re-discipline-knowledge-go",
    "version": "0.9.6",
    "sqliteDriver": "modernc.org/sqlite@v1.54.0",
    "numericalBackend": "fixed-int64-v1",
    "tieBreaker": "score-desc,path-asc,start-line-asc,chunk-id-asc"
  },
  "models": [
    {
      "id": "builtin:glove-6b-50d-top50k-q8-v1",
      "role": "embedding",
      "revision": "1",
      "implementation": "bundled-local",
      "specFile": "models/specs/glove-6b-50d-top50k-q8-v1.json",
      "specSha256": "2cdb94f94891907db8bdba40148dc6052b7d2cddacf868bb563092255ef1319a",
      "artifactFile": "models/artifacts/glove-6b-50d-top50k-q8-v1.bin",
      "artifactSha256": "fb108eef095f00bcc06a38e10d7f9671d9e6664ab79ae8a2c1cef5b31375b2ab",
      "license": "PDDL-1.0",
      "dimensions": 50,
      "normalization": "per-token-l2-q8; deterministic sentence-l2-int32",
      "networkRequired": false,
      "description": "Checksum-pinned local Stanford GloVe 6B 50d vocabulary subset with deterministic fixed-point sentence embeddings."
    }
  ],
  "externalModelPolicy": {
    "networkDownloads": false,
    "requireManifestEntry": true,
    "requireArtifactSha256": true,
    "requireLocalPathGrant": true
  }
}
